id,title,description,content_license,attribution_url,reading_level,cover_image_id,chapters
75,คุณแม่ในดวงใจ,,CREATIVE_COMMONS_CC_BY,https://www.letsreadasia.org/book/abe26c3b-ec11-48ee-b0d9-1578f6e1ea11?bookLang=5018465005993984,LEVEL1,921,"[{""image"":{""id"":922},""sortOrder"":0,""id"":889,""storyBookParagraphs"":[{""originalText"":""เจ วา เห็น แม่ ทำ กับข้าว"",""sortOrder"":0,""id"":1492}]},{""image"":{""id"":923},""sortOrder"":1,""id"":890,""storyBookParagraphs"":[{""originalText"":""เจ วา ช่วย แม่ ทำ กับข้าว"",""sortOrder"":0,""id"":1493}]},{""image"":{""id"":924},""sortOrder"":2,""id"":891,""storyBookParagraphs"":[{""originalText"":""แม่ บอก ให้ เจ วา หุง ข้าว เจ วา ก็ หุง ข้าว"",""sortOrder"":0,""id"":1494}]},{""image"":{""id"":925},""sortOrder"":3,""id"":892,""storyBookParagraphs"":[{""originalText"":""แม่ บอก ให้ เจ วา ตำ พริก เจ วา ก็ ตำ พริก"",""sortOrder"":0,""id"":1495}]},{""image"":{""id"":926},""sortOrder"":4,""id"":893,""storyBookParagraphs"":[{""originalText"":""แม่ บอก ให้ เจ วา เด็ด ผัก เจ วา ก็ เด็ด ผัก"",""sortOrder"":0,""id"":1496}]},{""image"":{""id"":927},""sortOrder"":5,""id"":894,""storyBookParagraphs"":[{""originalText"":""แม่ บอก ให้ เจ วา ต้ม ผัก เจ วา ก็ ต้ม ผัก"",""sortOrder"":0,""id"":1497}]},{""image"":{""id"":928},""sortOrder"":6,""id"":895,""storyBookParagraphs"":[{""originalText"":""เมื่อ ผัก สุก เจ วา เท ใส่ ใน จาน"",""sortOrder"":0,""id"":1498}]},{""image"":{""id"":929},""sortOrder"":7,""id"":896,""storyBookParagraphs"":[{""originalText"":""เจ วา กับ แม่ กิน ข้าว ด้วย กัน"",""sortOrder"":0,""id"":1499}]}]"
76,ฉันแต่งตัวเองได้!,มาดูสิ่งที่ฉันได้เรียนรู้ที่จะทำเพื่อตัวเองกัน!,,,LEVEL1,930,[]
77,ของเล่นที่หายไป,มีเด็กคนหนึ่งทำของเล่นชิ้นโปรดหายไป พวกเขาเศร้ามาก จะมีคนแปลกหน้าใจดีมาช่วยไหม?,,,LEVEL1,931,[]
78,ชิมมะม่วง!,เรื่องราวที่ไม่มีคำบรรยายนี้คือเรื่องราวของมะม่วงผู้ออกผจญภัยไปทั่วโลก เรามาทายกันว่าในที่สุดมะม่วงน้อยจะได้ลงเอยที่ไหน!,,,LEVEL1,932,"[{""image"":{""id"":933},""sortOrder"":0,""id"":897,""storyBookParagraphs"":[]}]"
79,ลูกหมูจอมเบ่ง,ลูกหมูชอบคุยโวว่าตัวเองแข็งแรงและเก่งกว่าเพื่อน ๆ เมื่อเพื่อน ๆ จับคู่พายเรือกันในแม่น้ำ ลูกหมูจึงพายไปตัวเดียว แต่แล้วกลับเกิดเรื่องไม่คาดคิดขึ้น ทำเอาลูกหมูแทบแย่เชียวละ!,CREATIVE_COMMONS_CC_BY,https://www.letsreadasia.org/book/7ec91262-2c1a-4237-a191-bf8f49edba3e?bookLang=5018465005993984,LEVEL3,934,"[{""image"":{""id"":935},""sortOrder"":0,""id"":898,""storyBookParagraphs"":[{""originalText"":""ลูก หมู ตัว ใหญ่ และ แข็งแรง ทุก ครั้ง ที่ เล่น ชัก กะ เย่อ กับ เพื่อน เพื่อน มัน จะ ชนะ เสมอ"",""sortOrder"":0,""id"":1500}]},{""image"":{""id"":936},""sortOrder"":1,""id"":899,""storyBookParagraphs"":[{""originalText"":""วัน หนึ่ง เจ้า ลิง อยาก พาย เรือ มัน จึง ชวน เพื่อน เพื่อน มา พาย ด้วย กัน"",""sortOrder"":0,""id"":1501}]},{""image"":{""id"":937},""sortOrder"":2,""id"":900,""storyBookParagraphs"":[{""originalText"":""\""ฉัน ไม่ พาย เรือ กับ พวก นาย หรอก \""ลูก หมู พูด"",""sortOrder"":0,""id"":1502},{""originalText"":""\""ก็ ฉัน ทั้ง แข็งแรง แถม ยัง เก่ง กว่า พวก นาย ด้วย \""มัน อวด เบ่ง"",""sortOrder"":1,""id"":1503}]},{""image"":{""id"":938},""sortOrder"":3,""id"":901,""storyBookParagraphs"":[{""originalText"":""กระต่าย จับ คู่ กับ หนู"",""sortOrder"":0,""id"":1504},{""originalText"":""ทั้ง สอง ลง เรือ ลำ เดียวกัน"",""sortOrder"":1,""id"":1505}]},{""image"":{""id"":939},""sortOrder"":4,""id"":902,""storyBookParagraphs"":[{""originalText"":""ลูก หมู ยิ้ม มัน ลง เรือ ไป ตัว เดียว"",""sortOrder"":0,""id"":1506}]},{""image"":{""id"":940},""sortOrder"":5,""id"":903,""storyBookParagraphs"":[{""originalText"":""ลูก หมู จ้วง พาย อย่าง รวดเร็ว มัน พาย พาย แล้ว ก็ พาย จน แซง หน้า เรือ เพื่อน เพื่อน ไป ทุก ลำ แล้ว มัน ก็ หัวเราะ เยาะ \"" เห็น ไหม ฉัน พาย เก่ง กว่า พวก นาย \"" ลูก หมู อวด เบ่ง"",""sortOrder"":0,""id"":1507}]},{""image"":{""id"":941},""sortOrder"":6,""id"":904,""storyBookParagraphs"":[{""originalText"":""\""ลูก หมู! นาย ไป ไกล เกิน แล้ว นะ \""เจ้า ลิง บอก"",""sortOrder"":0,""id"":1508}]},{""image"":{""id"":942},""sortOrder"":7,""id"":905,""storyBookParagraphs"":[{""originalText"":""จาก นั้น กระต่าย ลิง หนู และ หมา พา กัน พาย เรือก ลับ มา จนถึง ฝั่ง ทั้งหมด ต่าง ช่วย เพื่อน ขึ้น จาก เรือ แต่ ลูก หมู ไม่ อยู่ ตรง นั้น ด้วย"",""sortOrder"":0,""id"":1509}]},{""image"":{""id"":943},""sortOrder"":8,""id"":906,""storyBookParagraphs"":[{""originalText"":""\""ฮือ ฮือ ฮือ \""ลูก หมู ร้องไห้ ใหญ่ แล้ว ละ"",""sortOrder"":0,""id"":1510},{""originalText"":""\""ช่วย ฉัน ด้วย ฉัน เหนื่อย ฉัน พาย กลับ ฝั่ง ไม่ ได้\"""",""sortOrder"":1,""id"":1511}]},{""image"":{""id"":944},""sortOrder"":9,""id"":907,""storyBookParagraphs"":[{""originalText"":""เพื่อน เพื่อน ได้ยิน เสียง ลูก หมู ร้องไห้"",""sortOrder"":0,""id"":1512},{""originalText"":""\""ฮือ ฮือ ฮือ \""ลูก หมู ร้อง"",""sortOrder"":1,""id"":1513},{""originalText"":""\""ช่วย ด้วย! ฉัน อยาก กลับ บ้าน!\"""",""sortOrder"":2,""id"":1514}]},{""image"":{""id"":945},""sortOrder"":10,""id"":908,""storyBookParagraphs"":[{""originalText"":""กระต่าย ลิง และ หมา พา กันลง เรือ แล้ว พาย ไป หา ลูก หมู จาก นั้นทั้ง สาม ก็ ช่วย กัน พาย เรือ ลูก หมู กลับ เข้า ฝั่ง ลูก หมู มีค วาม สุข มาก มาก"",""sortOrder"":0,""id"":1515}]},{""image"":{""id"":946},""sortOrder"":11,""id"":909,""storyBookParagraphs"":[{""originalText"":""เดี๋ยวนี้ ลูก หมู ยอม เล่น กับ เพื่อน เพื่อน แล้ว มัน ไม่ อวด เบ่ง อีก เลย"",""sortOrder"":0,""id"":1516}]},{""image"":{""id"":947},""sortOrder"":12,""id"":910,""storyBookParagraphs"":[{""originalText"":""พำ อัน ลาว เป็น บริษัท ไม่ แสวง กำไร ซึ่ง ตี พิมพ์ หนังสือ เด็ก และ สนับสนุน เรื่อง การ อ่าน แก่ กลุ่ม ผู้ ด้อย โอกาส นัก เขียน ของ พำ อัน ทำ งาน ร่วม กัน เด็ก เด็ก และ ผู้ใหญ่ เพื่อ พัฒนา นิทาน ซึ่ง รวม ถึง เด็ก เด็ก ผู้ พิการ และ เด็ก เด็ก จาก ชนก ลุ่ม น้อย ด้วย พำ อัน ทั้ง พัฒนา ออก แบบ และ สร้างสรรค์ หนังสือ และ สื่อ การ สอน ให้ องค์การสหประชาชาติ (UN) และ องค์การ นอก ภาค รัฐ (NGO) และ ทำ งาน ใกล้ ชิด กับ กระทรวง ศึกษาธิการ และ การ กีฬา รวม ถึง กระทรวง เทคโนโลยี สารสนเทศ วัฒนธรรม และ การ ท่องเที่ยว"",""sortOrder"":0,""id"":1517}]}]"
80,ป้าของฉันขายปลา,ป้าของฉันขายปลาอยู่ที่ตลาด มาช่วยกันนับซิว่า ป้าของฉันขายปลาได้กี่ตัว,CREATIVE_COMMONS_CC_BY,https://www.letsreadasia.org/book/efce4a5a-7563-4e35-a42b-ae15ec7c900d?bookLang=5018465005993984,LEVEL1,949,"[{""image"":{""id"":950},""sortOrder"":0,""id"":911,""storyBookParagraphs"":[{""originalText"":""ป้า ของ ฉัน ขาย ปลา หนึ่ง ตัว"",""sortOrder"":0,""id"":1518}]},{""image"":{""id"":951},""sortOrder"":1,""id"":912,""storyBookParagraphs"":[{""originalText"":""ป้า ของ ฉัน ขาย ปลา สอง ตัว"",""sortOrder"":0,""id"":1519}]},{""image"":{""id"":952},""sortOrder"":2,""id"":913,""storyBookParagraphs"":[{""originalText"":""ป้า ของ ฉัน ขาย ปลา สาม ตัว"",""sortOrder"":0,""id"":1520}]},{""image"":{""id"":953},""sortOrder"":3,""id"":914,""storyBookParagraphs"":[{""originalText"":""ป้า ของ ฉัน ขาย ปลา สี่ ตัว"",""sortOrder"":0,""id"":1521}]},{""image"":{""id"":954},""sortOrder"":4,""id"":915,""storyBookParagraphs"":[{""originalText"":""ป้า ของ ฉัน ขาย ปลา ห้า ตัว"",""sortOrder"":0,""id"":1522}]},{""image"":{""id"":955},""sortOrder"":5,""id"":916,""storyBookParagraphs"":[{""originalText"":""ป้า ของ ฉัน ขาย ปลา หก ตัว"",""sortOrder"":0,""id"":1523}]},{""image"":{""id"":956},""sortOrder"":6,""id"":917,""storyBookParagraphs"":[{""originalText"":""ป้า ของ ฉัน ขาย ปลา เจ็ด ตัว"",""sortOrder"":0,""id"":1524}]},{""image"":{""id"":957},""sortOrder"":7,""id"":918,""storyBookParagraphs"":[{""originalText"":""ป้า ของ ฉัน ขาย ปลา แปด ตัว"",""sortOrder"":0,""id"":1525}]},{""image"":{""id"":958},""sortOrder"":8,""id"":919,""storyBookParagraphs"":[{""originalText"":""ป้า ของ ฉัน ขาย ปลา เก้า ตัว"",""sortOrder"":0,""id"":1526}]},{""image"":{""id"":959},""sortOrder"":9,""id"":920,""storyBookParagraphs"":[{""originalText"":""ป้า ของ ฉัน ขาย ปลา สิบ ตัว"",""sortOrder"":0,""id"":1527}]},{""sortOrder"":10,""id"":921,""storyBookParagraphs"":[{""originalText"":""Pum Anh Lao เป็น องค์กร เพื่อ สังคม ที่ ไม่ แสวง หา ผล กำไร จัด พิมพ์ หนังสือ สำหรับ เด็ก และ ส่งเสริม การ อ่าน ให้ กลุ่ม ผู้ ด้อย โอกาส Pum Anh จัด เวิร์ก ช็อปสำหรับ นัก เขียน ร่วม กับ เด็ก และ ผู้ใหญ่ เพื่อ เขียน เรื่องราว ต่าง ต่าง รวม ถึง เด็ก พิการ และ ชนก ลุ่ม น้อย ทาง ชาติพันธุ์ ด้วย Pum Anh ได้ พัฒนา ออก แบบ และ วาด ภาพ สื่อ การ สอน และ หนังสือ เพื่อ รอง รับ การ อ่าน หลากหลาย รูป แบบ สำหรับ หน่วย งาน ของ สหประชาชาติ และ องค์กร พัฒนา เอกชน โดย ทำ งาน ใกล้ ชิด กับ กระทรวง ศึกษาธิการ และ การ กีฬา กระทรวง สารสนเทศ วัฒนธรรม และ การ ท่องเที่ยว"",""sortOrder"":0,""id"":1528},{""originalText"":""แปล โดย บุญ ฑิกา รัต น ประสิทธิ์ กุล"",""sortOrder"":1,""id"":1529}]}]"
81,ครอบครัวอีกาทำนาปลูกข้าว,อีกาครอบครัวหนึ่งทำนาข้าวเองทุกขั้นตอน ตั้งแต่หว่านเมล็ด เก็บเกี่ยว จนได้ข้าวนึ่งใหม่ส่งกลิ่นหอม ไปเรียนรู้วิธีปลูกข้าวกับครอบครัวอีกากันเถอะ!,CREATIVE_COMMONS_CC_BY,https://www.letsreadasia.org/book/3fad0e69-8eea-426d-bff0-bc5fa042154d?bookLang=5018465005993984,LEVEL1,960,"[{""sortOrder"":0,""id"":922,""storyBookParagraphs"":[{""originalText"":""อีกา ครอบครัว หนึ่ง อาศัย อยู่ ใน ชนบท"",""sortOrder"":0,""id"":1530}]},{""sortOrder"":1,""id"":923,""storyBookParagraphs"":[{""originalText"":""ถึง ฤดู ทำ นา ข้าว แล้ว"",""sortOrder"":0,""id"":1531},{""originalText"":""อีกา ใช้ ควาย ไถนา เอา ไว้"",""sortOrder"":1,""id"":1532}]},{""image"":{""id"":961},""sortOrder"":2,""id"":924,""storyBookParagraphs"":[{""originalText"":""จาก นั้น อีกา และ ครอบครัว ก็ หว่าน เมล็ด ข้าว"",""sortOrder"":0,""id"":1533}]},{""sortOrder"":3,""id"":925,""storyBookParagraphs"":[{""originalText"":""พอ เมล็ด ข้าว ที่ หว่าน ไว้ เติบโต ขึ้น เป็นต้น กล้า ครอบครัว อีกา ก็ ถอน ต้น กล้า เพื่อ ย้าย ที่"",""sortOrder"":0,""id"":1534}]},{""image"":{""id"":962},""sortOrder"":4,""id"":926,""storyBookParagraphs"":[{""originalText"":""ครอบครัว อีกา หาบ ต้น กล้า อย่าง ระมัดระวัง ไป ยัง ทุ่ง นา อีก ผืน"",""sortOrder"":0,""id"":1535}]},{""sortOrder"":5,""id"":927,""storyBookParagraphs"":[{""originalText"":""หลาย เดือน ผ่าน ไป"",""sortOrder"":0,""id"":1536},{""originalText"":""ต้น ข้าว ก็ เติบโต และ ออก รวง เหลือง อร่าม เต็ม ทุ่ง นา"",""sortOrder"":1,""id"":1537}]},{""image"":{""id"":963},""sortOrder"":6,""id"":928,""storyBookParagraphs"":[{""originalText"":""ครอบครัว อีกา เก็บเกี่ยว รวง ข้าว"",""sortOrder"":0,""id"":1538}]},{""image"":{""id"":964},""sortOrder"":7,""id"":929,""storyBookParagraphs"":[{""originalText"":""จาก นั้น ก็ หาบ รวง ข้าว ที่ มัด ไว้ ออก จาก ทุ่ง นา"",""sortOrder"":0,""id"":1539}]},{""sortOrder"":8,""id"":930,""storyBookParagraphs"":[{""originalText"":""ครอบครัว อีกา ฟาด มัด ข้าว ให้ ข้าวเปลือก หลุด ออก มา เสร็จ แล้ว จึง ตาก ข้าวเปลือก ไว้"",""sortOrder"":0,""id"":1540}]},{""sortOrder"":9,""id"":931,""storyBookParagraphs"":[{""originalText"":""ครอบครัว อีกา ตำ ข้าวเปลือก"",""sortOrder"":0,""id"":1541},{""originalText"":""เพื่อ กระ เทาะเป ลือ ก ข้าว ออก"",""sortOrder"":1,""id"":1542}]},{""image"":{""id"":965},""sortOrder"":10,""id"":932,""storyBookParagraphs"":[{""originalText"":""เสร็จ แล้ว ก็ เก็บข้าว เปลือก ไว้ ใน ยุ้ง ฉาง"",""sortOrder"":0,""id"":1543}]},{""sortOrder"":11,""id"":933,""storyBookParagraphs"":[{""originalText"":""กลิ่น หอม เหลือเกิน ข้าวนึ่ง ใหม่ ใหม่ หอม มาก เลย ละ"",""sortOrder"":0,""id"":1544}]},{""sortOrder"":12,""id"":934,""storyBookParagraphs"":[{""originalText"":""มา มา มา"",""sortOrder"":0,""id"":1545},{""originalText"":""มา ร่วม วง กิน ข้าวนึ่ง ใหม่ หอม หอม กับ ครอบครัว อีกา กัน เถอะ"",""sortOrder"":1,""id"":1546}]},{""image"":{""id"":966},""sortOrder"":13,""id"":935,""storyBookParagraphs"":[]},{""sortOrder"":14,""id"":936,""storyBookParagraphs"":[{""originalText"":""แปล โดย กัญ ญ ภัทร วัน ดี"",""sortOrder"":0,""id"":1547}]}]"
82,โตโต้เลียนแบบคุณปู่,คุณปู่ของโตโต้ชอบปลูกพืชสมุนไพร แล้วโตโต้ได้เรียนรู้อะไรจากคุณปู่ของเธอบ้างนะ ไปดูกันเถอะ!,CREATIVE_COMMONS_CC_BY,https://www.letsreadasia.org/book/f07cac38-6f12-487c-bb02-ff1b273e8dad?bookLang=5018465005993984,LEVEL1,967,"[{""image"":{""id"":968},""sortOrder"":0,""id"":937,""storyBookParagraphs"":[{""originalText"":""คุณ ปู่ ปลูก พืช สมุนไพร หลาย อย่าง"",""sortOrder"":0,""id"":1548}]},{""image"":{""id"":969},""sortOrder"":1,""id"":938,""storyBookParagraphs"":[{""originalText"":""โต โต้ ก็ หัด ปลูก พืช สมุนไพร ด้วย"",""sortOrder"":0,""id"":1549}]},{""image"":{""id"":970},""sortOrder"":2,""id"":939,""storyBookParagraphs"":[{""originalText"":""คุณ ปู่ ปลูก มะเขือเทศ"",""sortOrder"":0,""id"":1550}]},{""image"":{""id"":971},""sortOrder"":3,""id"":940,""storyBookParagraphs"":[{""originalText"":""โต โต้ ก็ หัด ปลูก มะเขือเทศ ด้วย"",""sortOrder"":0,""id"":1551}]},{""image"":{""id"":972},""sortOrder"":4,""id"":941,""storyBookParagraphs"":[{""originalText"":""คุณ ปู่ ปลูก ต้น บวบ"",""sortOrder"":0,""id"":1552}]},{""image"":{""id"":973},""sortOrder"":5,""id"":942,""storyBookParagraphs"":[{""originalText"":""โต โต้ ก็ หัด ปลูก ต้น บวบ ด้วย"",""sortOrder"":0,""id"":1553}]},{""image"":{""id"":974},""sortOrder"":6,""id"":943,""storyBookParagraphs"":[{""originalText"":""คุณ ปู่ ปลูก มันฝรั่ง"",""sortOrder"":0,""id"":1554}]},{""image"":{""id"":975},""sortOrder"":7,""id"":944,""storyBookParagraphs"":[{""originalText"":""โต โต้ ก็ หัด ปลูก มันฝรั่ง ด้วย"",""sortOrder"":0,""id"":1555}]},{""image"":{""id"":976},""sortOrder"":8,""id"":945,""storyBookParagraphs"":[{""originalText"":""คุณ ปู่ ปลูก ข้าวโพด"",""sortOrder"":0,""id"":1556}]},{""image"":{""id"":977},""sortOrder"":9,""id"":946,""storyBookParagraphs"":[{""originalText"":""โต โต้ ก็ หัด ปลูก ข้าวโพด ด้วย"",""sortOrder"":0,""id"":1557}]},{""image"":{""id"":978},""sortOrder"":10,""id"":947,""storyBookParagraphs"":[{""originalText"":""โต โต้ ปลูก ผัก เป็น แล้ว นะ เหมือนกับ คุณ ปู่ เลย"",""sortOrder"":0,""id"":1558}]},{""image"":{""id"":979},""sortOrder"":11,""id"":948,""storyBookParagraphs"":[{""originalText"":""โต โต้ มีค วาม สุข คุณ ปู่ ก็ มีค วาม สุข ด้วย"",""sortOrder"":0,""id"":1559}]},{""image"":{""id"":980},""sortOrder"":12,""id"":949,""storyBookParagraphs"":[{""originalText"":""โต โต้ มีค วาม สุข คุณ ปู่ ก็ มีค วาม สุข ด้วย"",""sortOrder"":0,""id"":1560},{""originalText"":""แปล โดย ณัฐ พงษ์ บุญ ยะ ศรี"",""sortOrder"":1,""id"":1561}]}]"
