id,title,description,content_license,attribution_url,reading_level,cover_image_id,chapters
1,Cuộc đua kì thú,Ốc Sên và Thỏ chạy thi. Ai sẽ là người chiến thắng đây? Một câu chuyện ngụ ngôn dành cho các bạn nhỏ!,CREATIVE_COMMONS_CC_BY,http://www.africanstorybook.org/,LEVEL3,,[]
2,Bươm Bướm và Mỏ Sừng,,,https://storyweaver.org.in/en/stories/105612-buom-buom-va-mo-sung,LEVEL1,2.0,"[{""image"":{""id"":3},""sortOrder"":0,""id"":1,""storyBookParagraphs"":[]},{""image"":{""id"":4},""sortOrder"":1,""id"":2,""storyBookParagraphs"":[{""originalText"":""Bạn Bươm Bướm nhỏ hơn anh Xén Tóc."",""sortOrder"":0,""id"":1}]},{""image"":{""id"":5},""sortOrder"":2,""id"":3,""storyBookParagraphs"":[{""originalText"":""Anh Xén Tóc lại bé hơn chú Chim."",""sortOrder"":0,""id"":2}]},{""image"":{""id"":6},""sortOrder"":3,""id"":4,""storyBookParagraphs"":[{""originalText"":""Chú Chim thì còi hơn bác Vẹt."",""sortOrder"":0,""id"":3}]},{""image"":{""id"":7},""sortOrder"":4,""id"":5,""storyBookParagraphs"":[{""originalText"":""Bác Vẹt không to bằng ông Cú."",""sortOrder"":0,""id"":4}]},{""image"":{""id"":8},""sortOrder"":5,""id"":6,""storyBookParagraphs"":[{""originalText"":""Nhưng \u201cđô\u201d nhất chính là cậu Mỏ Sừng."",""sortOrder"":0,""id"":5}]},{""image"":{""id"":9},""sortOrder"":6,""id"":7,""storyBookParagraphs"":[{""originalText"":""Bạn Bươm Bướm là em bé út ít."",""sortOrder"":0,""id"":6}]},{""image"":{""id"":10},""sortOrder"":7,""id"":8,""storyBookParagraphs"":[{""originalText"":""Tuyệt nhất là tất cả đều biết bay!"",""sortOrder"":0,""id"":7}]}]"
3,Tớ đi học,,,,,11.0,"[{""image"":{""id"":12},""sortOrder"":0,""id"":9,""storyBookParagraphs"":[]},{""image"":{""id"":13},""sortOrder"":1,""id"":10,""storyBookParagraphs"":[{""originalText"":""Tháng đầu tiên, tớ được đến trường."",""sortOrder"":0,""id"":8}]},{""image"":{""id"":14},""sortOrder"":2,""id"":11,""storyBookParagraphs"":[{""originalText"":""Tháng thứ hai, tớ có thể tự mở sách."",""sortOrder"":0,""id"":9}]},{""image"":{""id"":15},""sortOrder"":3,""id"":12,""storyBookParagraphs"":[{""originalText"":""Tháng thứ ba, tớ đã có thể viết được chữ."",""sortOrder"":0,""id"":10}]},{""image"":{""id"":16},""sortOrder"":4,""id"":13,""storyBookParagraphs"":[{""originalText"":""Tới tháng thứ tư, tớ đã biết đếm số!"",""sortOrder"":0,""id"":11}]},{""image"":{""id"":17},""sortOrder"":5,""id"":14,""storyBookParagraphs"":[{""originalText"":""Sang tháng thứ năm, tớ học phép tính cộng."",""sortOrder"":0,""id"":12}]},{""image"":{""id"":18},""sortOrder"":6,""id"":15,""storyBookParagraphs"":[{""originalText"":""Tớ biết làm phép trừ ở tháng thứ sáu."",""sortOrder"":0,""id"":13}]},{""image"":{""id"":19},""sortOrder"":7,""id"":16,""storyBookParagraphs"":[{""originalText"":""Tháng thứ bảy, tớ đã biết tự soạn sách vở."",""sortOrder"":0,""id"":14}]},{""image"":{""id"":20},""sortOrder"":8,""id"":17,""storyBookParagraphs"":[{""originalText"":""Tớ học chơi thể thao vào tháng thứ tám."",""sortOrder"":0,""id"":15}]},{""image"":{""id"":21},""sortOrder"":9,""id"":18,""storyBookParagraphs"":[{""originalText"":""Vào tháng thứ chín, tớ đã biết đọc sách."",""sortOrder"":0,""id"":16}]},{""image"":{""id"":22},""sortOrder"":10,""id"":19,""storyBookParagraphs"":[{""originalText"":""Tớ biết tô màu vào tháng thứ mười."",""sortOrder"":0,""id"":17}]},{""image"":{""id"":23},""sortOrder"":11,""id"":20,""storyBookParagraphs"":[{""originalText"":""Tháng thứ mười một, tớ được học vẽ."",""sortOrder"":0,""id"":18}]},{""image"":{""id"":24},""sortOrder"":12,""id"":21,""storyBookParagraphs"":[{""originalText"":""Tháng thứ mười hai, tớ đã đứng đầu lớp."",""sortOrder"":0,""id"":19}]}]"
4,Tớ đi học,,,,,25.0,"[{""image"":{""id"":26},""sortOrder"":0,""id"":22,""storyBookParagraphs"":[]},{""image"":{""id"":27},""sortOrder"":1,""id"":23,""storyBookParagraphs"":[{""originalText"":""Tháng đầu tiên, tớ được đến trường."",""sortOrder"":0,""id"":20}]},{""image"":{""id"":28},""sortOrder"":2,""id"":24,""storyBookParagraphs"":[{""originalText"":""Tháng thứ hai, tớ có thể tự mở sách."",""sortOrder"":0,""id"":21}]},{""image"":{""id"":29},""sortOrder"":3,""id"":25,""storyBookParagraphs"":[{""originalText"":""Tháng thứ ba, tớ đã có thể viết được chữ."",""sortOrder"":0,""id"":22}]},{""image"":{""id"":30},""sortOrder"":4,""id"":26,""storyBookParagraphs"":[{""originalText"":""Tới tháng thứ tư, tớ đã biết đếm số!"",""sortOrder"":0,""id"":23}]},{""image"":{""id"":31},""sortOrder"":5,""id"":27,""storyBookParagraphs"":[{""originalText"":""Sang tháng thứ năm, tớ học phép tính cộng."",""sortOrder"":0,""id"":24}]},{""image"":{""id"":32},""sortOrder"":6,""id"":28,""storyBookParagraphs"":[{""originalText"":""Tớ biết làm phép trừ ở tháng thứ sáu."",""sortOrder"":0,""id"":25}]},{""image"":{""id"":33},""sortOrder"":7,""id"":29,""storyBookParagraphs"":[{""originalText"":""Tháng thứ bảy, tớ đã biết tự soạn sách vở."",""sortOrder"":0,""id"":26}]},{""image"":{""id"":34},""sortOrder"":8,""id"":30,""storyBookParagraphs"":[{""originalText"":""Tớ học chơi thể thao vào tháng thứ tám."",""sortOrder"":0,""id"":27}]},{""image"":{""id"":35},""sortOrder"":9,""id"":31,""storyBookParagraphs"":[{""originalText"":""Vào tháng thứ chín, tớ đã biết đọc sách."",""sortOrder"":0,""id"":28}]},{""image"":{""id"":36},""sortOrder"":10,""id"":32,""storyBookParagraphs"":[{""originalText"":""Tớ biết tô màu vào tháng thứ mười."",""sortOrder"":0,""id"":29}]},{""image"":{""id"":37},""sortOrder"":11,""id"":33,""storyBookParagraphs"":[{""originalText"":""Tháng thứ mười một, tớ được học vẽ."",""sortOrder"":0,""id"":30}]},{""image"":{""id"":38},""sortOrder"":12,""id"":34,""storyBookParagraphs"":[{""originalText"":""Tháng thứ mười hai, tớ đã đứng đầu lớp."",""sortOrder"":0,""id"":31}]}]"
5,Chiếc bánh to,"Dom Dom có một chiếc bánh to, cậu ấy sẽ làm gì với chiếc bánh đây?",CREATIVE_COMMONS_CC_BY,https://storyweaver.org.in/en/stories/105647-chiec-banh-to,LEVEL1,39.0,"[{""image"":{""id"":40},""sortOrder"":0,""id"":35,""storyBookParagraphs"":[]},{""image"":{""id"":41},""sortOrder"":1,""id"":36,""storyBookParagraphs"":[{""originalText"":""Dom Dom có một chiếc bánh thật là to."",""sortOrder"":0,""id"":32}]},{""image"":{""id"":42},""sortOrder"":2,""id"":37,""storyBookParagraphs"":[{""originalText"":""Dom Dom cắt bánh ra làm 8 miếng."",""sortOrder"":0,""id"":33}]},{""image"":{""id"":43},""sortOrder"":3,""id"":38,""storyBookParagraphs"":[{""originalText"":""Một miếng biếu bà."",""sortOrder"":0,""id"":34}]},{""image"":{""id"":44},""sortOrder"":4,""id"":39,""storyBookParagraphs"":[{""originalText"":""Một miếng biếu ông."",""sortOrder"":0,""id"":35}]},{""image"":{""id"":45},""sortOrder"":5,""id"":40,""storyBookParagraphs"":[{""originalText"":""Một miếng dành cho mẹ."",""sortOrder"":0,""id"":36}]},{""image"":{""id"":46},""sortOrder"":6,""id"":41,""storyBookParagraphs"":[{""originalText"":""Một miếng cho bố."",""sortOrder"":0,""id"":37}]},{""image"":{""id"":47},""sortOrder"":7,""id"":42,""storyBookParagraphs"":[{""originalText"":""Một miếng tặng dì."",""sortOrder"":0,""id"":38}]},{""image"":{""id"":48},""sortOrder"":8,""id"":43,""storyBookParagraphs"":[{""originalText"":""Một miếng tặng chú."",""sortOrder"":0,""id"":39}]},{""image"":{""id"":49},""sortOrder"":9,""id"":44,""storyBookParagraphs"":[{""originalText"":""Một miếng cho chị."",""sortOrder"":0,""id"":40}]},{""image"":{""id"":50},""sortOrder"":10,""id"":45,""storyBookParagraphs"":[{""originalText"":""Miếng còn lại phần Dom Dom."",""sortOrder"":0,""id"":41}]},{""image"":{""id"":51},""sortOrder"":11,""id"":46,""storyBookParagraphs"":[{""originalText"":""Ông bà, bố mẹ, chú dì ăn bánh."",""sortOrder"":0,""id"":42}]},{""image"":{""id"":52},""sortOrder"":12,""id"":47,""storyBookParagraphs"":[{""originalText"":""Dom Dom và chị cũng cùng ăn."",""sortOrder"":0,""id"":43}]},{""image"":{""id"":53},""sortOrder"":13,""id"":48,""storyBookParagraphs"":[]}]"
