id,title,description,content_license,attribution_url,reading_level,cover_image_id,chapters
2,Bươm Bướm và Mỏ Sừng,,,https://storyweaver.org.in/en/stories/105612-buom-buom-va-mo-sung,LEVEL1,2,"[{""image"":{""id"":3},""sortOrder"":0,""id"":1,""storyBookParagraphs"":[]},{""image"":{""id"":4},""sortOrder"":1,""id"":2,""storyBookParagraphs"":[{""originalText"":""Bạn Bươm Bướm nhỏ hơn anh Xén Tóc."",""sortOrder"":0,""id"":1}]},{""image"":{""id"":5},""sortOrder"":2,""id"":3,""storyBookParagraphs"":[{""originalText"":""Anh Xén Tóc lại bé hơn chú Chim."",""sortOrder"":0,""id"":2}]},{""image"":{""id"":6},""sortOrder"":3,""id"":4,""storyBookParagraphs"":[{""originalText"":""Chú Chim thì còi hơn bác Vẹt."",""sortOrder"":0,""id"":3}]},{""image"":{""id"":7},""sortOrder"":4,""id"":5,""storyBookParagraphs"":[{""originalText"":""Bác Vẹt không to bằng ông Cú."",""sortOrder"":0,""id"":4}]},{""image"":{""id"":8},""sortOrder"":5,""id"":6,""storyBookParagraphs"":[{""originalText"":""Nhưng \u201cđô\u201d nhất chính là cậu Mỏ Sừng."",""sortOrder"":0,""id"":5}]},{""image"":{""id"":9},""sortOrder"":6,""id"":7,""storyBookParagraphs"":[{""originalText"":""Bạn Bươm Bướm là em bé út ít."",""sortOrder"":0,""id"":6}]},{""image"":{""id"":10},""sortOrder"":7,""id"":8,""storyBookParagraphs"":[{""originalText"":""Tuyệt nhất là tất cả đều biết bay!"",""sortOrder"":0,""id"":7}]}]"
3,Tớ đi học,,,https://storyweaver.org.in/en/stories/105422-to-di-hoc,LEVEL1,11,"[{""image"":{""id"":12},""sortOrder"":0,""id"":9,""storyBookParagraphs"":[]},{""image"":{""id"":13},""sortOrder"":1,""id"":10,""storyBookParagraphs"":[{""originalText"":""Tháng đầu tiên, tớ được đến trường."",""sortOrder"":0,""id"":8}]},{""image"":{""id"":14},""sortOrder"":2,""id"":11,""storyBookParagraphs"":[{""originalText"":""Tháng thứ hai, tớ có thể tự mở sách."",""sortOrder"":0,""id"":9}]},{""image"":{""id"":15},""sortOrder"":3,""id"":12,""storyBookParagraphs"":[{""originalText"":""Tháng thứ ba, tớ đã có thể viết được chữ."",""sortOrder"":0,""id"":10}]},{""image"":{""id"":16},""sortOrder"":4,""id"":13,""storyBookParagraphs"":[{""originalText"":""Tới tháng thứ tư, tớ đã biết đếm số!"",""sortOrder"":0,""id"":11}]},{""image"":{""id"":17},""sortOrder"":5,""id"":14,""storyBookParagraphs"":[{""originalText"":""Sang tháng thứ năm, tớ học phép tính cộng."",""sortOrder"":0,""id"":12}]},{""image"":{""id"":18},""sortOrder"":6,""id"":15,""storyBookParagraphs"":[{""originalText"":""Tớ biết làm phép trừ ở tháng thứ sáu."",""sortOrder"":0,""id"":13}]},{""image"":{""id"":19},""sortOrder"":7,""id"":16,""storyBookParagraphs"":[{""originalText"":""Tháng thứ bảy, tớ đã biết tự soạn sách vở."",""sortOrder"":0,""id"":14}]},{""image"":{""id"":20},""sortOrder"":8,""id"":17,""storyBookParagraphs"":[{""originalText"":""Tớ học chơi thể thao vào tháng thứ tám."",""sortOrder"":0,""id"":15}]},{""image"":{""id"":21},""sortOrder"":9,""id"":18,""storyBookParagraphs"":[{""originalText"":""Vào tháng thứ chín, tớ đã biết đọc sách."",""sortOrder"":0,""id"":16}]},{""image"":{""id"":22},""sortOrder"":10,""id"":19,""storyBookParagraphs"":[{""originalText"":""Tớ biết tô màu vào tháng thứ mười."",""sortOrder"":0,""id"":17}]},{""image"":{""id"":23},""sortOrder"":11,""id"":20,""storyBookParagraphs"":[{""originalText"":""Tháng thứ mười một, tớ được học vẽ."",""sortOrder"":0,""id"":18}]},{""image"":{""id"":24},""sortOrder"":12,""id"":21,""storyBookParagraphs"":[{""originalText"":""Tháng thứ mười hai, tớ đã đứng đầu lớp."",""sortOrder"":0,""id"":19}]}]"
5,Chiếc bánh to,"Dom Dom có một chiếc bánh to, cậu ấy sẽ làm gì với chiếc bánh đây?",CREATIVE_COMMONS_CC_BY,https://storyweaver.org.in/en/stories/105647-chiec-banh-to,LEVEL1,39,"[{""image"":{""id"":40},""sortOrder"":0,""id"":35,""storyBookParagraphs"":[]},{""image"":{""id"":41},""sortOrder"":1,""id"":36,""storyBookParagraphs"":[{""originalText"":""Dom Dom có một chiếc bánh thật là to."",""sortOrder"":0,""id"":32}]},{""image"":{""id"":42},""sortOrder"":2,""id"":37,""storyBookParagraphs"":[{""originalText"":""Dom Dom cắt bánh ra làm 8 miếng."",""sortOrder"":0,""id"":33}]},{""image"":{""id"":43},""sortOrder"":3,""id"":38,""storyBookParagraphs"":[{""originalText"":""Một miếng biếu bà."",""sortOrder"":0,""id"":34}]},{""image"":{""id"":44},""sortOrder"":4,""id"":39,""storyBookParagraphs"":[{""originalText"":""Một miếng biếu ông."",""sortOrder"":0,""id"":35}]},{""image"":{""id"":45},""sortOrder"":5,""id"":40,""storyBookParagraphs"":[{""originalText"":""Một miếng dành cho mẹ."",""sortOrder"":0,""id"":36}]},{""image"":{""id"":46},""sortOrder"":6,""id"":41,""storyBookParagraphs"":[{""originalText"":""Một miếng cho bố."",""sortOrder"":0,""id"":37}]},{""image"":{""id"":47},""sortOrder"":7,""id"":42,""storyBookParagraphs"":[{""originalText"":""Một miếng tặng dì."",""sortOrder"":0,""id"":38}]},{""image"":{""id"":48},""sortOrder"":8,""id"":43,""storyBookParagraphs"":[{""originalText"":""Một miếng tặng chú."",""sortOrder"":0,""id"":39}]},{""image"":{""id"":49},""sortOrder"":9,""id"":44,""storyBookParagraphs"":[{""originalText"":""Một miếng cho chị."",""sortOrder"":0,""id"":40}]},{""image"":{""id"":50},""sortOrder"":10,""id"":45,""storyBookParagraphs"":[{""originalText"":""Miếng còn lại phần Dom Dom."",""sortOrder"":0,""id"":41}]},{""image"":{""id"":51},""sortOrder"":11,""id"":46,""storyBookParagraphs"":[{""originalText"":""Ông bà, bố mẹ, chú dì ăn bánh."",""sortOrder"":0,""id"":42}]},{""image"":{""id"":52},""sortOrder"":12,""id"":47,""storyBookParagraphs"":[{""originalText"":""Dom Dom và chị cũng cùng ăn."",""sortOrder"":0,""id"":43}]},{""image"":{""id"":53},""sortOrder"":13,""id"":48,""storyBookParagraphs"":[]}]"
6,Sinh nhật Bơ,,,https://storyweaver.org.in/en/stories/31278-sinh-nhat-bo,LEVEL2,54,"[{""image"":{""id"":55},""sortOrder"":0,""id"":49,""storyBookParagraphs"":[]},{""image"":{""id"":56},""sortOrder"":1,""id"":50,""storyBookParagraphs"":[{""originalText"":""Bon nghỉ hè rồi! Bon đi tìm mẹ, rủ mẹ chơi cùng."",""sortOrder"":0,""id"":44},{""originalText"":""Nhưng mẹ đang bận việc. Mẹ dịu dàng bảo: \u201cBon tìm ba nhé!\u201d"",""sortOrder"":1,""id"":45}]},{""image"":{""id"":57},""sortOrder"":2,""id"":51,""storyBookParagraphs"":[{""originalText"":""Bon bèn rủ ba: \u201cBa ơi! Chơi đá banh với Bon đi.\u201d"",""sortOrder"":0,""id"":46}]},{""image"":{""id"":58},""sortOrder"":3,""id"":52,""storyBookParagraphs"":[{""originalText"":""Ba lắc đầu: \u201cBa sắp đi làm rồi. Để ba tìm xem trong cặp có gì cho Bon không?\u201d"",""sortOrder"":0,""id"":47}]},{""image"":{""id"":59},""sortOrder"":4,""id"":53,""storyBookParagraphs"":[{""originalText"":""\u201cA, có bịch bong bóng này."",""sortOrder"":0,""id"":48},{""originalText"":""Ba cho Bon hết đó. Ba đi làm nha.\u201d"",""sortOrder"":1,""id"":49}]},{""image"":{""id"":60},""sortOrder"":5,""id"":54,""storyBookParagraphs"":[{""originalText"":""Bon chạy vào tìm chị Su."",""sortOrder"":0,""id"":50},{""originalText"":""Chị Su nói: \u201cChị bận cắt giấy trang trí cho liên hoan ở lớp. Chị cho Bon mấy tờ giấy màu để xếp máy bay nhé.\u201d"",""sortOrder"":1,""id"":51}]},{""image"":{""id"":61},""sortOrder"":6,""id"":55,""storyBookParagraphs"":[{""originalText"":""Bon buồn lắm: \u201cCả nhà ai cũng bận cả. Chẳng ai chơi với Bon!\u201d"",""sortOrder"":0,""id"":52}]},{""image"":{""id"":62},""sortOrder"":7,""id"":56,""storyBookParagraphs"":[{""originalText"":""Thế là Bon đành ra vườn chơi với Vẹt Bơ."",""sortOrder"":0,""id"":53}]},{""image"":{""id"":63},""sortOrder"":8,""id"":57,""storyBookParagraphs"":[{""originalText"":""Vẹt Bơ nghiêng nghiêng đầu nhìn Bon."",""sortOrder"":0,""id"":54},{""originalText"":""Bon cũng nghiêng nghiêng đầu nhìn Vẹt Bơ."",""sortOrder"":1,""id"":55},{""originalText"":""Bỗng nhiên Bon chợt nảy ra một ý tưởng."",""sortOrder"":2,""id"":56}]},{""image"":{""id"":64},""sortOrder"":9,""id"":58,""storyBookParagraphs"":[{""originalText"":""Có bóng bay này! Có giấy màu này!"",""sortOrder"":0,""id"":57},{""originalText"":""Bon loay hoay suốt mấy ngày, cắt cắt rồi lại dán dán."",""sortOrder"":1,""id"":58}]},{""image"":{""id"":65},""sortOrder"":10,""id"":59,""storyBookParagraphs"":[{""originalText"":""Cuối cùng thứ Bảy cũng đến. Ai cũng được nghỉ ở nhà."",""sortOrder"":0,""id"":59},{""originalText"":""Bon reo vui: \u201cCon mời cả nhà dự tiệc sinh nhật nhé.\u201d"",""sortOrder"":1,""id"":60}]},{""image"":{""id"":66},""sortOrder"":11,""id"":60,""storyBookParagraphs"":[{""originalText"":""Cả nhà ngạc nhiên lắm: \u201cSinh nhật ai? Hôm nay đâu phải sinh nhật Bon?\u201d"",""sortOrder"":0,""id"":61},{""originalText"":""Bon chỉ cười cười: \u201cCứ đi theo con sẽ biết!\u201d"",""sortOrder"":1,""id"":62}]},{""image"":{""id"":67},""sortOrder"":12,""id"":61,""storyBookParagraphs"":[{""originalText"":""\u201cA ha! Hôm nay là ngày sinh nhật của Bơ! Bơ về nhà mình vừa tròn một năm.\u201d"",""sortOrder"":0,""id"":63},{""originalText"":""\u201cBon mời cả nhà ăn sinh nhật nhé. Có mặt đông đủ mọi người, thế mới vui!\u201d"",""sortOrder"":1,""id"":64}]},{""image"":{""id"":68},""sortOrder"":13,""id"":62,""storyBookParagraphs"":[{""originalText"":""Cả nhà gật gù: \u201cÀ ra thế! Hôm nay sinh nhật Bơ.\u201d Ba tặng đồ chơi, chị tặng bánh kẹo, mẹ làm cả bánh kem nữa."",""sortOrder"":0,""id"":65}]},{""image"":{""id"":69},""sortOrder"":14,""id"":63,""storyBookParagraphs"":[{""originalText"":""Cả nhà vui vẻ quây quần bên nhau."",""sortOrder"":0,""id"":66},{""originalText"":""Ai cũng thấy vui, nhất là Bon và Bơ."",""sortOrder"":1,""id"":67}]},{""image"":{""id"":70},""sortOrder"":15,""id"":64,""storyBookParagraphs"":[]}]"
7,Cái Hạt Đi Lạc,,CREATIVE_COMMONS_CC_BY,https://storyweaver.org.in/en/stories/35233-cai-hat-di-lac,LEVEL3,71,"[{""image"":{""id"":72},""sortOrder"":0,""id"":65,""storyBookParagraphs"":[]},{""image"":{""id"":73},""sortOrder"":1,""id"":66,""storyBookParagraphs"":[{""originalText"":""Một hôm, trên đường đi học về, bé thấy chim thả xuống một cái hạt."",""sortOrder"":0,""id"":68}]},{""image"":{""id"":74},""sortOrder"":2,""id"":67,""storyBookParagraphs"":[{""originalText"":""Bé nhặt lên: \u201cHạt gì đây nhỉ?\u201d"",""sortOrder"":0,""id"":69}]},{""image"":{""id"":75},""sortOrder"":3,""id"":68,""storyBookParagraphs"":[{""originalText"":""Bé đem hạt về cho ông."",""sortOrder"":0,""id"":70}]},{""image"":{""id"":76},""sortOrder"":4,""id"":69,""storyBookParagraphs"":[{""originalText"":""Ông cười móm mém: \u201cÔng chỉ thích trồng bon-sai.\u201d"",""sortOrder"":0,""id"":71},{""originalText"":""\u201cCây thu mình bé lại, cây uốn lượn. Ông chiết cành chứ không gieo hạt.\u201d"",""sortOrder"":1,""id"":72}]},{""image"":{""id"":77},""sortOrder"":5,""id"":70,""storyBookParagraphs"":[{""originalText"":""Bé đem hạt đến cho bà. Bà nhìn thật lâu..."",""sortOrder"":0,""id"":73},{""originalText"":""\u201cKhông phải hạt lúa đâu nhỉ. Cháu nhìn xem, những cánh đồng mênh mông. Bà thích trồng ra lúa gạo thôi!\u201d"",""sortOrder"":1,""id"":74}]},{""image"":{""id"":78},""sortOrder"":6,""id"":71,""storyBookParagraphs"":[{""originalText"":""Bé đem hạt đi tìm cha."",""sortOrder"":0,""id"":75}]},{""image"":{""id"":79},""sortOrder"":7,""id"":72,""storyBookParagraphs"":[{""originalText"":""\u201cKhông phải hạt cây ăn quả. Cha không trồng trong vườn cây ăn quả được.\u201d"",""sortOrder"":0,""id"":76},{""originalText"":""Cha chỉ cho bé xem..."",""sortOrder"":1,""id"":77}]},{""image"":{""id"":80},""sortOrder"":8,""id"":73,""storyBookParagraphs"":[{""originalText"":""Hạt của trái mít xù xì?"",""sortOrder"":0,""id"":78},{""originalText"":""Không phải!"",""sortOrder"":1,""id"":79},{""originalText"":""Hạt của trái cam mọng nước?"",""sortOrder"":2,""id"":80},{""originalText"":""Không đúng!"",""sortOrder"":3,""id"":81},{""originalText"":""Hạt của trái xoài ngọt ngào?"",""sortOrder"":4,""id"":82},{""originalText"":""Không giống!"",""sortOrder"":5,""id"":83},{""originalText"":""Hạt của trái nhãn thơm phức?"",""sortOrder"":6,""id"":84},{""originalText"":""Không luôn!"",""sortOrder"":7,""id"":85}]},{""image"":{""id"":81},""sortOrder"":9,""id"":74,""storyBookParagraphs"":[{""originalText"":""Cũng không phải hạt vú sữa hay hạt mãng cầu."",""sortOrder"":0,""id"":86}]},{""image"":{""id"":82},""sortOrder"":10,""id"":75,""storyBookParagraphs"":[{""originalText"":""Bé đem hạt đi hỏi mẹ."",""sortOrder"":0,""id"":87}]},{""image"":{""id"":83},""sortOrder"":11,""id"":76,""storyBookParagraphs"":[{""originalText"":""\u201cMẹ không biết hạt này, mẹ không trồng trong vườn rau quả được.\u201d"",""sortOrder"":0,""id"":88}]},{""image"":{""id"":84},""sortOrder"":12,""id"":77,""storyBookParagraphs"":[{""originalText"":""Mẹ ôm bé vào lòng."",""sortOrder"":0,""id"":89},{""originalText"":""Mẹ chỉ cho bé xem..."",""sortOrder"":1,""id"":90}]},{""image"":{""id"":85},""sortOrder"":13,""id"":78,""storyBookParagraphs"":[{""originalText"":""Hạt cải - không phải!"",""sortOrder"":0,""id"":91},{""originalText"":""Hạt ngò - không đúng!"",""sortOrder"":1,""id"":92},{""originalText"":""Hạt mướp - không giống!"",""sortOrder"":2,""id"":93},{""originalText"":""Hạt bầu - không luôn!"",""sortOrder"":3,""id"":94}]},{""image"":{""id"":86},""sortOrder"":14,""id"":79,""storyBookParagraphs"":[{""originalText"":""Cũng không phải hạt dưa leo xanh mát, hạt khổ qua đắng thanh, hạt cà chua ngọt lành."",""sortOrder"":0,""id"":95}]},{""image"":{""id"":87},""sortOrder"":15,""id"":80,""storyBookParagraphs"":[{""originalText"":""Bé cầm hạt tìm đến chị."",""sortOrder"":0,""id"":96}]},{""image"":{""id"":88},""sortOrder"":16,""id"":81,""storyBookParagraphs"":[{""originalText"":""Chị nhìn rồi hỏi lại bé: \u201cHạt gì đây nhỉ?\u201d"",""sortOrder"":0,""id"":97},{""originalText"":""\u201cChắc không ra được hoa hồng, hoa lan, hoa sen, hoa cúc đâu!\u201d"",""sortOrder"":1,""id"":98}]},{""image"":{""id"":89},""sortOrder"":17,""id"":82,""storyBookParagraphs"":[{""originalText"":""Bé buồn xo, cầm hạt đi ra vườn. Bé ước gì hỏi được chim: \u201cHạt gì đây nhỉ?\u201d"",""sortOrder"":0,""id"":99},{""originalText"":""Bé quyết định gieo thử hạt xuống đất."",""sortOrder"":1,""id"":100}]},{""image"":{""id"":90},""sortOrder"":18,""id"":83,""storyBookParagraphs"":[{""originalText"":""Hết nắng Rồi mưa Hết đêm Rồi ngày"",""sortOrder"":0,""id"":101},{""originalText"":""Bé mải chơi, quên mất."",""sortOrder"":1,""id"":102}]},{""image"":{""id"":91},""sortOrder"":19,""id"":84,""storyBookParagraphs"":[{""originalText"":""Một hôm ra vườn, bé reo lên: \u201cA hạt đã nảy mầm!"",""sortOrder"":0,""id"":103},{""originalText"":""Từ hạt nhú ra một vài cái lá. Rồi thân cây mềm mại quấn quanh cái giàn trơ trụi gần đó."",""sortOrder"":1,""id"":104}]},{""image"":{""id"":92},""sortOrder"":20,""id"":85,""storyBookParagraphs"":[{""originalText"":""Cả nhà đi qua đi lại,"",""sortOrder"":0,""id"":105},{""originalText"":""ai cũng hỏi:"",""sortOrder"":1,""id"":106},{""originalText"":""- Ai trồng cây lạ nhỉ?"",""sortOrder"":2,""id"":107},{""originalText"":""- Cây gì mọc đẹp nhỉ?"",""sortOrder"":3,""id"":108},{""originalText"":""- Cây gì buồn cười nhỉ?"",""sortOrder"":4,""id"":109},{""originalText"":""- Cây gì leo giỏi nhỉ?"",""sortOrder"":5,""id"":110}]},{""image"":{""id"":93},""sortOrder"":21,""id"":86,""storyBookParagraphs"":[{""originalText"":""Chỉ sau một mùa hè,"",""sortOrder"":0,""id"":111},{""originalText"":""cây xanh tốt đã phủ kín giàn."",""sortOrder"":1,""id"":112},{""originalText"":""Vẫn không ai biết đó là cây gì."",""sortOrder"":2,""id"":113}]},{""image"":{""id"":94},""sortOrder"":22,""id"":87,""storyBookParagraphs"":[{""originalText"":""Nhưng từ nay, cả nhà có thêm một chỗ ngồi nghỉ và chơi đùa dưới bóng mát của cây."",""sortOrder"":0,""id"":114},{""originalText"":""Mẹ bảo bé đặt tên cho cây. Bé thầm thì: \u201cCây tên là...Hạt Đi Lạc!\u201d"",""sortOrder"":1,""id"":115}]},{""image"":{""id"":95},""sortOrder"":23,""id"":88,""storyBookParagraphs"":[]}]"
8,Sóc con đi học,,CREATIVE_COMMONS_CC_BY,https://storyweaver.org.in/en/stories/31013-soc-con-di-hoc,LEVEL2,96,"[{""image"":{""id"":97},""sortOrder"":0,""id"":89,""storyBookParagraphs"":[]},{""image"":{""id"":98},""sortOrder"":1,""id"":90,""storyBookParagraphs"":[{""originalText"":""Từ bé Sóc và Mây đã chơi cùng nhau."",""sortOrder"":0,""id"":116}]},{""image"":{""id"":99},""sortOrder"":2,""id"":91,""storyBookParagraphs"":[{""originalText"":""Vui thật là vui!"",""sortOrder"":0,""id"":117}]},{""image"":{""id"":100},""sortOrder"":3,""id"":92,""storyBookParagraphs"":[{""originalText"":""Một tối nọ, Mây nói:"",""sortOrder"":0,""id"":118},{""originalText"":""-Mai Sóc đi học cùng Mây nhé!"",""sortOrder"":1,""id"":119}]},{""image"":{""id"":101},""sortOrder"":4,""id"":93,""storyBookParagraphs"":[{""originalText"":""-Ôi, mình sợ lắm! Đi học có gì vui đâu!"",""sortOrder"":0,""id"":120}]},{""image"":{""id"":102},""sortOrder"":5,""id"":94,""storyBookParagraphs"":[{""originalText"":""Lên đường!"",""sortOrder"":0,""id"":121},{""originalText"":""Hôm sau, từ lúc trời chưa sáng, cả hai đã bắt đầu đi đến trường."",""sortOrder"":1,""id"":122}]},{""image"":{""id"":103},""sortOrder"":6,""id"":95,""storyBookParagraphs"":[{""originalText"":""Tối ơi là tối!"",""sortOrder"":0,""id"":123}]},{""image"":{""id"":104},""sortOrder"":7,""id"":96,""storyBookParagraphs"":[{""originalText"":""Sóc bỗng la lên: Trời ơi! Thú dữ kia!"",""sortOrder"":0,""id"":124}]},{""image"":{""id"":105},""sortOrder"":8,""id"":97,""storyBookParagraphs"":[{""originalText"":""Mây chiếu đèn pin vào và phát hiện ra:"",""sortOrder"":0,""id"":125},{""originalText"":""-Không phải đâu, đó chỉ là những tảng đá thôi."",""sortOrder"":1,""id"":126},{""originalText"":""-May quá!"",""sortOrder"":2,""id"":127}]},{""image"":{""id"":106},""sortOrder"":9,""id"":98,""storyBookParagraphs"":[{""originalText"":""Cả hai đi tiếp và gặp một dòng suối gầm gừ hung dữ."",""sortOrder"":0,""id"":128},{""originalText"":""-Hay mình quay về đi!"",""sortOrder"":1,""id"":129}]},{""image"":{""id"":107},""sortOrder"":10,""id"":99,""storyBookParagraphs"":[]},{""image"":{""id"":108},""sortOrder"":11,""id"":100,""storyBookParagraphs"":[{""originalText"":""\u201cỐi! Ướt hết rồi! Mình muốn về nhà cơ!\u201d"",""sortOrder"":0,""id"":130}]},{""image"":{""id"":109},""sortOrder"":12,""id"":101,""storyBookParagraphs"":[{""originalText"":""\u201cÔi! Ướt hết rồi! Mình muốn về nhà cơ!\u201d"",""sortOrder"":0,""id"":131}]},{""image"":{""id"":110},""sortOrder"":13,""id"":102,""storyBookParagraphs"":[{""originalText"":""\u201cĐừng khóc nữa nhé, mặt trời lên rồi! Sóc sẽ khô ngay thôi.\u201d"",""sortOrder"":0,""id"":132}]},{""image"":{""id"":111},""sortOrder"":14,""id"":103,""storyBookParagraphs"":[{""originalText"":""\u201cChỗ này đẹp quá! Chúng mình đừng đi học nữa, ở lại đây chơi đi!\u201d"",""sortOrder"":0,""id"":133}]},{""image"":{""id"":112},""sortOrder"":15,""id"":104,""storyBookParagraphs"":[{""originalText"":""\u201cÀ, không! Đến trường còn vui hơn rất nhiều. Đi nào Sóc!\u201d"",""sortOrder"":0,""id"":134}]},{""image"":{""id"":113},""sortOrder"":16,""id"":105,""storyBookParagraphs"":[{""originalText"":""\u201cSóc không muốn đi học. Đi học có gì vui đâu!\u201d"",""sortOrder"":0,""id"":135}]},{""image"":{""id"":114},""sortOrder"":17,""id"":106,""storyBookParagraphs"":[{""originalText"":""\u201cĐường đến trường còn xa lắm, Sóc không muốn đi nữa đâu.\u201d"",""sortOrder"":0,""id"":136}]},{""image"":{""id"":115},""sortOrder"":18,""id"":107,""storyBookParagraphs"":[{""originalText"":""\u201cA!"",""sortOrder"":0,""id"":137},{""originalText"":""Sóc nhỏ"",""sortOrder"":1,""id"":138},{""originalText"":""nhìn xem!"",""sortOrder"":2,""id"":139}]},{""image"":{""id"":116},""sortOrder"":19,""id"":108,""storyBookParagraphs"":[{""originalText"":""... Trường ở kia rồi!\u201d"",""sortOrder"":0,""id"":140}]},{""image"":{""id"":117},""sortOrder"":20,""id"":109,""storyBookParagraphs"":[{""originalText"":""-Ơ! Ở đây sao có nhiều bạn quả này!"",""sortOrder"":0,""id"":141}]},{""image"":{""id"":118},""sortOrder"":21,""id"":110,""storyBookParagraphs"":[{""originalText"":""Ôi! Vui quá! Haha!"",""sortOrder"":0,""id"":142}]},{""image"":{""id"":119},""sortOrder"":22,""id"":111,""storyBookParagraphs"":[{""originalText"":""Mai mình đi học nữa Mây!"",""sortOrder"":0,""id"":143},{""originalText"":""Đi học đúng là vui thật!"",""sortOrder"":1,""id"":144}]},{""image"":{""id"":120},""sortOrder"":23,""id"":112,""storyBookParagraphs"":[]}]"
